{
  "schema_version": "0.2.3",
  "approval_id": "approval:gov-001",
  "run_id": "run:gov-001",
  "intent_id": "intent:gov-001",
  "trigger_event_id": "evt_gov_001",
  "requested_action": "publish",
  "target": "demo://published/release",
  "risk_class": "medium",
  "reason": "external publish requires human authorization",
  "options": [
    "approve",
    "deny"
  ],
  "evidence_refs": [
    "validation:gov-001"
  ],
  "authority_requested": {
    "scope": [
      "publish"
    ],
    "max_uses": 1
  },
  "requested_at": "2026-08-20T08:00:00+00:00",
  "expires_at": "2026-08-20T09:00:00+00:00",
  "status": "pending"
}
